{
  "version": 2,
  "musicId": 10,
  "revision": 4,
  "updatedAt": "2026-07-31T00:00:00Z",
  "state": "complete",
  "attributions": [
    {
      "provider": "sekaipedia",
      "title": "新曲",
      "revisionId": 34,
      "revisionUrl": "https://www.sekaipedia.org/wiki/New_Song?oldid=34",
      "licenseName": "CC BY-SA 4.0",
      "licenseUrl": "https://creativecommons.org/licenses/by-sa/4.0/"
    },
    {
      "provider": "moegirl_public_exact",
      "title": "亿年爱恋",
      "revisionId": 78,
      "revisionUrl": "https://zh.moegirl.org.cn/%E4%BA%BF%E5%B9%B4%E7%88%B1%E6%81%8B",
      "licenseName": "CC BY-NC-SA 3.0",
      "licenseUrl": "https://creativecommons.org/licenses/by-nc-sa/3.0/"
    }
  ],
  "translationCredits": {
    "translation": "MoeSeka Translation Team",
    "proofreading": "MoeSeka Translation Team"
  },
  "availableVersions": [
    "full",
    "game"
  ],
  "lines": [
    {
      "id": "line-1",
      "order": 0,
      "japanese": "初音が歌う",
      "zh-CN": "初音在歌唱",
      "en-US": "Miku sings",
      "segments": [
        {
          "text": "初音",
          "performerIds": [
            1
          ],
          "ruby": [
            {
              "text": "初音",
              "reading": "はつね"
            }
          ]
        },
        {
          "text": "が歌う",
          "performerIds": [
            1
          ],
          "ruby": [
            {
              "text": "が"
            },
            {
              "text": "歌",
              "reading": "うた"
            },
            {
              "text": "う"
            }
          ]
        }
      ]
    },
    {
      "id": "line-2",
      "order": 1,
      "japanese": "未来へ",
      "zh-CN": "向着未来",
      "en-US": "Toward the future",
      "stanzaBreakBefore": true,
      "segments": [
        {
          "text": "未来へ",
          "performerIds": [
            1,
            2
          ],
          "ruby": [
            {
              "text": "未来",
              "reading": "みらい"
            },
            {
              "text": "へ"
            }
          ]
        }
      ]
    },
    {
      "id": "line-3",
      "order": 2,
      "japanese": "進もう",
      "zh-CN": "前进吧",
      "en-US": "Let us move on",
      "segments": [
        {
          "text": "進もう",
          "performerIds": [],
          "ruby": [
            {
              "text": "進",
              "reading": "すす"
            },
            {
              "text": "もう"
            }
          ]
        }
      ],
      "trailingPerformerIds": [
        2
      ]
    }
  ],
  "gameProjection": {
    "reasonCode": "tagged_full_and_game",
    "lineIds": [
      "line-1",
      "line-3"
    ]
  }
}
