{
  "version": 2,
  "musicId": 11,
  "revision": 1,
  "updatedAt": "2026-07-31T01:00:00Z",
  "state": "complete",
  "attributions": [
    {
      "provider": "vocaloid_fandom",
      "title": "長い歌",
      "revisionId": 90,
      "revisionUrl": "https://vocaloid.fandom.com/wiki/Long_Song?oldid=90",
      "licenseName": "CC BY-SA 3.0",
      "licenseUrl": "https://creativecommons.org/licenses/by-sa/3.0/"
    }
  ],
  "translationCredits": {
    "translation": "Legacy Translator"
  },
  "availableVersions": [
    "full"
  ],
  "lines": [
    {
      "id": "line-1",
      "order": 0,
      "japanese": "長い歌詞",
      "zh-CN": "",
      "en-US": "",
      "segments": [
        {
          "text": "長い歌詞",
          "performerIds": [],
          "ruby": [
            {
              "text": "長",
              "reading": "なが"
            },
            {
              "text": "い"
            },
            {
              "text": "歌詞",
              "reading": "かし"
            }
          ]
        }
      ]
    }
  ]
}
